{
  "schema_version": "automatic-experiment-request-v1",
  "task_name": "example_mean_stats",
  "task": "读取 experiment/inputs/example_mean.csv，真实计算其中全部有限数值的均值、样本数、最小值和最大值，并生成正式报告。",
  "input_refs": [
    {
      "id": "values_csv",
      "path": "experiment/inputs/example_mean.csv",
      "description": "示例数值表，含一列有限数值。",
      "required": true
    }
  ],
  "success_criteria": [],
  "method_constraints": [],
  "resource_budget": {
    "wall_seconds": 600,
    "cpu_seconds": 1200,
    "memory_mb": 4096,
    "disk_mb": 1024,
    "single_file_mb": 256,
    "stdout_kb": 10240,
    "stderr_kb": 10240,
    "max_attempts": 3,
    "gpu_count": 0,
    "gpu_memory_mb": 0
  },
  "run_budget": {
    "total_wall_seconds": 1800,
    "max_stages": 5,
    "max_total_attempts": 6
  },
  "seed_policy": {
    "mode": "fixed",
    "seeds": [
      42
    ]
  },
  "replay_of": null,
  "user_notes": ""
}